,name,total_rating,cost_rank,abv,cask_type,smoky,peaty,spicy,herbal,oily,full_bodied,rich,sweet,briny,salty,vanilla,tart,fruity,floral
1825,"Booker's Bourbon Batch 2017-02 ""Blue Knights Batch""",128,3,63.7,"new, charred American oak",10,0,65,20,40,60,50,35,20,10,40,25,10,15
1826,Kilkerran Work in Progress #7 Sherry Wood,15,3,46.0,Sherry Oak,25,15,20,35,50,60,55,35,30,15,25,35,40,0
1827,Big Peat Fèis Ìle 2017,3,4,48.0,Finished in Sherry Casks,50,60,10,20,30,65,40,45,10,10,15,10,30,0
1828,Mackmyra 10 Year,26,3,46.1,"ex-bourbon, American oak ex-oloroso sherry",0,0,50,30,40,45,50,60,20,30,70,55,65,55
1829,Jura 10 Year,725,3,40.0,"ex-bourbon, finished in oloroso sherry butts",40,40,60,40,30,50,50,65,20,20,30,40,70,10
1830,Highland Park Valkyrie,313,3,49.5,ex-bourbon and ex-sherry,70,50,75,45,30,40,45,35,70,75,60,45,50,20
1831,Bladnoch Talia 25 Year,8,5,49.2,"ex-bourbon, ex-sherry, ex-whisky, finished in new American oak",0,0,65,40,65,70,75,70,10,0,70,75,70,50
1832,Woodinville Straight 100% Rye,141,3,45.0,"new, charred American oak",20,0,80,60,30,70,60,50,0,0,50,30,0,20
1833,Basil Hayden's Rye (Discontinued),293,2,40.0,"new, charred American oak; then recasked in charred, quarter-casks",10,0,60,20,20,50,40,50,0,0,40,10,15,10
1834,Old Ripy Kentucky Straight Bourbon,54,4,52.0,"new, charred American oak",25,0,65,30,20,40,40,40,0,0,30,20,40,0
1835,Yamazakura 963 21 Year,5,5,58.0,,10,15,60,20,35,35,40,70,28,21,80,40,85,45
1836,Arran White Stag (Second Release),0,5,49.5,ex-sherry,0,0,65,30,40,70,75,50,10,10,50,60,75,50
1837,English Whisky Company Classic Single Malt,6,2,46.0,,20,25,15,10,15,45,45,35,0,0,50,20,20,20
1838,Ezra Brooks Straight Rye,103,1,45.0,"new, charred American oak",20,0,35,15,25,35,45,60,0,0,60,10,15,20
1839,Wyoming Whiskey Outryder,77,3,50.0,"new, charred American oak",10,0,60,40,30,60,60,50,0,0,70,10,20,0
1840,Headframe Spirits Neversweat Bourbon,10,2,40.0,,30,0,45,30,10,40,35,40,10,0,40,0,50,50
1841,Two Brewers Yukon Single Malt (Release 3),9,4,43.0,First-Fill Bourbon Barrels,50,50,30,30,10,45,40,35,25,15,35,10,50,25
1842,Highland Park Fire Edition,49,5,45.2,100% refill Port seasoned casks,75,40,60,65,75,60,65,50,30,20,50,40,60,65
1843,Ninety 5 Year Whisky,5,1,45.0,Charred Oak,40,0,50,20,20,45,50,50,0,0,40,10,50,25
1844,Zuidam Millstone 1999 Special #1 PX Cask,12,4,46.0,ex-Bourbon and ex-Pedro Ximenez sherry,50,35,50,10,20,50,55,55,10,10,35,35,60,35
1845,Queen Jennie Sorghum Whiskey,18,3,40.0,"small, charred oak barrels",10,0,35,10,30,30,40,50,10,0,40,10,20,0
1846,Cider Barrel Matured Virginia Highland Malt Whisky (Batch 1),8,3,46.0,finished in ex-cider casks,10,0,60,20,40,50,70,40,0,0,30,40,70,40
1847,Adnams Single Malt No. 1,11,3,43.0,new French oak,0,0,55,10,20,40,40,75,0,0,75,80,80,20
1848,Ardbeg 21 Year,27,5,46.0,Ex-Bourbon,40,20,30,15,55,45,35,55,20,5,35,20,50,5
1849,Sons of Liberty Pumpkin Spice Whiskey,4,2,40.0,,20,0,70,20,40,50,70,60,0,0,40,30,80,0
1850,Glenfiddich Project XX,540,3,47.0,"Port pipes, Sherry butts, and first-fill bourbon",0,0,30,10,10,40,40,60,5,0,50,60,40,20
1851,Blaum Bros. OldFangled Knotter Bourbon 9 Year,29,3,56.25,"new, charred american oak",0,0,90,0,45,70,75,65,0,15,60,0,75,10
1852,Glynnevan Double Barrelled Canadian Rye,16,2,43.0,,40,0,50,10,25,45,40,50,25,20,45,20,55,30
1853,Loch Lomond 12 Year,333,3,46.0,"ex-bourbon, refill, re-charge",30,10,5,0,5,40,40,60,0,0,40,10,50,5
1854,Armorik Maître de Chai Single Malt,6,3,47.3,first-fill oloroso sherry,5,0,70,40,50,75,75,60,5,5,50,40,50,60
1855,Glencadam Origin 1825,33,2,40.0,American white oak bourbon casks and finished Oloroso sherry butts,0,0,80,30,20,30,30,60,0,0,70,60,80,80
1856,Tullamore D.E.W. 18 Year Single Malt,40,4,41.3,"finished in ex-bourbon, ex-oloroso sherry, ex-port, & ex-madeira",20,0,50,20,40,60,60,50,0,10,50,20,30,30
1857,Lost Distillery Lossit,62,2,43.0,,50,40,30,10,20,59,60,50,30,30,40,20,60,20
1858,Glen Grant 12 Year,278,2,43.0,,0,0,20,30,20,50,60,50,0,0,30,20,50,50
1859,Two Brewers Yukon Single Malt (Release 2),5,4,46.0,Assorted Barrels and ex Pedro Ximenez sherry casks.,50,0,40,15,15,50,55,65,0,0,50,20,55,45
1860,Macallan Double Cask 12 Year,1863,3,43.0,American and European sherry-seasoned oak,0,0,40,0,60,70,70,60,0,0,50,40,60,10
1861,Ohishi Sherry Single Cask Whisky,143,3,42.3,ex-sherry cask,5,0,40,40,30,40,45,40,20,10,30,10,30,35
1862,Clynelish Select Reserve (2015 Special Release),7,5,56.1,"ex-bourbon, refill American oak hogshead, refill European oak butt",15,0,30,25,20,70,60,60,10,0,40,15,50,20
1863,Kavalan Solist Fino Single Cask Strength,50,5,57.8,ex-Fino Sherry Cask,0,0,55,15,60,65,65,75,5,0,70,70,75,35
1864,Zuidam Millstone 12 Year Sherry Cask,19,4,46.0,ex-Oloroso Sherry,55,20,60,35,25,40,60,55,15,35,50,60,70,20
1865,Ichiro's Malt Double Distilleries,34,4,46.0,Ex-Sherry and Japanese oak,20,15,80,30,45,50,62,75,15,10,51,27,39,24
1866,Yamazakura 16 Year Blended Whisky,34,4,40.0,Ex-Bourbon American Oak,15,10,75,30,25,60,20,80,10,20,65,18,70,25
1867,33 Straight Bourbon Whiskey,10,2,43.0,"new, charred American oak",20,0,30,0,25,40,40,30,10,0,40,10,15,10
1868,Rhetoric 22 Year Bourbon,157,4,45.0,"new, charred American oak",30,0,60,40,20,70,60,50,0,0,70,40,20,0
1869,1792 Full Proof Straight Bourbon,1635,2,62.5,"new, charred American oak",10,0,25,0,20,80,75,70,0,0,30,15,40,0
1870,Bruichladdich Islay Barley 2009,153,3,50.0,American oak,20,0,55,10,10,50,25,25,10,10,40,0,15,15
1871,Bruichladdich The Laddie 8 Year,73,3,50.0,American and European oak,5,0,70,50,40,40,50,60,10,20,60,45,70,65
1872,Kilkerran Work in Progress #7 Bourbon Wood,15,4,54.1,ex-bourbon,50,45,15,35,60,70,40,20,15,10,60,10,70,15
1873,Ballantine's 21 Year,75,4,43.0,European Oak,5,0,35,10,40,50,55,20,0,10,25,0,35,10
1874,Black Button Four Grain Bourbon,57,2,42.0,"new, charred American oak",20,0,55,75,30,50,40,85,0,0,55,0,35,10
1875,Black Button Moonshine,1,2,50.0,unaged,0,0,60,80,70,70,45,80,5,0,5,0,25,10
1876,anCnoc Rascan,37,3,46.0,ex-bourbon,40,45,40,50,0,35,30,50,0,60,0,0,0,0
1877,The Glenrothes Bourbon Cask Reserve,186,3,40.0,ex-bourbon,20,0,60,20,20,60,60,70,10,10,70,30,70,10
1878,Glenmorangie Tarlogan,55,4,43.0,virgin oak and ex-bourbon,5,0,15,0,15,70,70,70,0,0,50,0,30,0
1879,Canadian Club 20 Year,27,3,40.0,Used American Oak Barrels,45,0,55,25,30,40,45,60,0,0,50,25,55,25
1880,O.K.I. Reserve Straight Bourbon 9 Year,54,2,48.87,"new, charred American oak",10,0,50,35,0,60,75,20,15,0,0,0,0,0
1881,Glenfarclas 8 Year,24,4,40.0,European oak ex-oloroso sherry cask,0,0,45,45,20,30,15,65,0,0,60,55,60,60
1882,"Colonel E.H. Taylor, Jr. Seasoned Wood Bottled in Bond Bourbon",124,3,50.0,seasoned oak,20,0,70,40,10,60,60,40,0,0,50,10,10,0
1883,Valley Shine Benjamin's Bourbon Whiskey,6,2,40.0,"new, charred American oak",5,0,30,10,10,35,35,20,5,5,25,5,5,10
1884,High West Valley Tan,49,3,43.5,second-fill bourbon and new American white oak,0,0,30,20,40,50,60,50,0,0,30,20,40,10
1885,Yamazaki Puncheon 2013,4,4,48.0,Puncheon (American Oak),15,10,35,20,30,40,55,85,15,20,75,10,80,60
1886,Amrut Single Cask Peated Barley Port Pipe,5,4,59.5,"ex-bourbon, ex-port",70,40,70,20,10,80,80,30,10,0,10,40,50,20
1887,Slow Hand Six Woods Organic Malt Whiskey,29,3,42.0,"French oak vats with house-toasted staves of hickory, mulberry, red oak, hard maple, and grape woods",0,0,30,0,20,40,35,50,0,0,30,0,40,10
1888,Kavalan Solist Moscatel Single Cask Strength,19,5,50.0,ex-Moscatel wine cask,0,10,40,50,40,60,80,70,10,0,20,40,80,40
1889,Penderyn Sherrywood,52,2,46.0,"ex-bourbon, finished in ex-oloroso sherry",0,0,85,20,40,70,30,75,20,60,70,65,80,65
1890,Loch Lomond Inchmurrin Madeira Wood Finish,58,3,46.0,American White Oak and Madeira Wine,10,0,30,30,40,70,70,50,0,0,20,50,70,30
1891,Loch Lomond Inchmurrin 12 Year,129,2,46.0,"American bourbon, re-fill, and re-charred oak",15,0,35,30,10,40,40,50,15,15,25,40,25,0
1892,Gouden Carolus Single Malt,144,2,46.0,first-fill bourbon and custom Het Anker,5,0,35,45,40,45,45,65,15,10,35,35,40,45
1893,Kikori Whiskey,165,2,41.0,"American oak, French Limousin, and Spanish sherry",0,0,20,30,30,30,30,20,10,0,20,0,35,50
1894,Highland Park 10 Year,212,2,40.0,ex-sherry,50,60,50,30,10,40,30,55,20,40,50,70,40,10
1895,Yamazaki Sherry Cask (2016 Edition),32,5,48.0,ex-Oloroso sherry casks,30,0,55,15,15,45,40,40,0,0,20,60,85,25
1896,Old Pulteney 17 Year,255,3,46.0,American Ex-Bourbon and Spanish Ex-Sherry (Pedro Ximenez & Oloroso),10,0,40,50,30,70,80,70,55,60,65,55,100,30
1897,Barrell Bourbon Batch 006,42,4,61.45,"new, charred American oak",10,0,90,10,75,80,85,75,0,10,70,0,70,15
1898,Jameson Distillery Reserve 12 Year,100,3,40.0,"ex-bourbon, ex-sherry ",10,0,40,20,20,60,60,70,0,10,60,20,60,40
1899,Mosswood Sherry Aged Irish Whiskey,9,3,46.0,finished in Amontillado sherry,10,0,20,10,30,40,40,40,10,0,25,0,10,0
1900,Glenlivet Nàdurra Peated Whisky Cask Finish,181,4,61.5,finished in heavily-peated whisky barrels,60,50,40,20,10,50,30,40,0,0,30,20,30,30
1901,J. Henry & Sons 5 Year Small Batch Wisconsin Straight Bourbon,154,2,46.0,"new, charred American oak",10,0,30,20,5,60,50,60,0,5,30,15,40,0
1902,Hillrock Estate Port Cask Finished Double Cask Rye,25,4,45.0,"new, charred American oak; finished in ex-port casks",15,0,30,0,5,75,70,60,0,0,30,5,50,0
1903,New World Projects:  Project X,4,3,42.1,,0,0,40,40,40,30,30,60,20,40,40,50,60,50
1904,Buffalo Trace Experimental Collection 13 Year Old-Fashioned Sour Mash Bourbon (105 Entry Proof),3,4,45.0,"new, charred American oak",0,0,20,0,50,30,40,60,0,0,50,10,0,0
1905,Taconic Distillery Barrel Strength Bourbon,38,2,57.5,"new, charred American oak",10,0,60,30,30,60,70,60,10,10,60,30,70,40
1906,Great Outback Rare Old Australian Single Malt,1,5,40.0,,20,0,20,30,0,10,10,70,20,20,20,30,40,0
1907,The Glenrothes Vintage Reserve,181,3,40.0,ex-bourbon & ex-Sherry,10,0,50,30,30,60,60,80,0,10,70,30,60,80
1908,Blair Athol 12 Year Flora & Fauna,155,3,43.0,"Ex-Bourbon, Ex-Sherry",15,0,5,40,35,40,55,10,0,0,25,10,35,10
1909,Overeem Port Cask Matured Single Malt,25,5,43.0,ex-port,20,10,40,40,40,50,70,50,10,10,60,30,60,70
1910,Watershed Bourbon (Discontinued),221,2,47.0,"new, charred American oak",0,0,30,20,20,50,60,80,0,0,70,0,30,10
1911,Paul John Edited Single Malt,95,2,46.0,,70,60,70,50,30,40,40,40,20,0,10,40,30,20
1912,66 Gilead Wild Oak Whisky,5,3,47.0,"new, charred oak",50,0,55,20,40,45,35,45,10,0,40,20,50,45
1913,Parker's Heritage Malt Whiskey 8 Year,99,4,54.0,"new, charred American oak",10,0,5,0,15,80,80,80,0,15,30,15,50,0
1914,Glen Garioch 1995,26,4,55.3,1st fill ex-bourbon,30,20,60,20,40,50,50,30,0,0,30,10,20,30
1915,Locke's 8 Year Single Malt,47,2,40.0,ex-bourbon casks,20,40,60,30,20,50,70,80,30,0,90,40,70,70
1916,Linkwood 15 Year Distillery Labels (Gordon & MacPhail),76,3,43.0,Refill sherry casks,0,0,20,20,35,40,50,55,0,0,20,25,70,25
1917,Glenmorangie Companta,42,4,46.0,Grand Cru & ex-fortified wine,0,0,35,25,45,65,45,35,0,20,10,20,25,30
1918,Crown Royal XO,252,2,40.0,finished in ex-cognac barrels,20,0,50,30,40,70,80,80,0,0,70,20,60,50
1919,Blade And Bow Bourbon 22 Year (2015 Release),60,5,46.0,"new, charred American oak",20,0,80,30,10,50,50,60,0,2,70,30,60,50
1920,Hellyers Road Original Single Malt,20,3,46.2,ex-Jack Daniels Barrels,10,0,40,30,50,60,50,60,0,10,70,30,60,50
1921,Hellyers Road Single Malt Pinot Noir Finish,53,3,46.2,"American white oak, ex-Pinot Noir wine casks",0,0,60,40,50,40,50,40,0,0,30,60,50,60
1922,Hibiki Japanese Harmony,3125,3,43.0,"variety of casks including American oak, Japanese Mizunara, and ex-sherry",10,0,20,60,0,40,20,50,0,0,30,10,50,70
1923,Strathmill 12 Year Flora & Fauna,22,3,43.0,,10,10,35,45,10,60,50,75,10,10,25,25,60,30
1924,Temperance Trader Chinato Barrel-Finished Bourbon,9,2,45.0,"new, charred American oak; finished in ex-chinato casks",0,0,40,90,10,30,10,50,0,0,60,10,80,30
1925,anCnoc Cutter,76,3,46.0,ex-bourbon,75,70,10,20,40,80,80,40,30,10,15,0,50,0
1926,West Cork 10 Year Single Malt,130,2,40.0,first-fill bourbon,0,0,20,20,50,70,70,70,0,0,80,60,80,60
1927,Hirsch Small Batch Reserve Kentucky Straight Bourbon,102,2,46.0,"new, charred American oak",0,0,80,10,30,70,70,70,0,10,70,30,60,50
1928,Clayton James Tennessee Whiskey,38,2,45.0,"new, charred American oak",40,0,60,20,30,80,80,70,0,0,80,50,80,70
1929,Craigellachie 19 Year,24,4,46.0,,20,5,65,50,20,40,40,50,5,5,35,25,50,15
1930,Re:Find Rye,14,2,45.0,"new, charred American oak",30,0,50,25,0,60,60,60,0,0,20,30,80,0
1931,Black Bottle Blended Scotch,324,2,40.0,,40,30,25,15,25,80,85,75,15,0,20,0,35,20
1932,Forged Oak 15 Year Bourbon,367,4,45.25,"new, charred American oak",30,0,80,30,0,70,70,60,0,2,70,30,60,50
1933,Zuidam Millstone 100 Rye Whisky,85,3,50.0,"new, charred American oak",0,0,80,20,0,90,80,60,0,20,70,10,70,20
1934,C.W. Irwin Straight Bourbon,8,2,40.0,new charred oak,10,0,20,40,10,40,40,60,0,20,15,0,15,0
1935,Reilly's Mother's Milk,6,1,40.0,,0,0,35,0,5,75,75,80,0,5,40,5,25,0
1936,Jefferson's Chef's Collaboration,183,2,46.0,"new, charred American oak",20,0,60,30,30,70,60,80,0,10,20,30,70,10
1937,Navazos-Palazzi Palo Cortado Cask Grain Whisky (July 2014),6,4,53.5,ex-palo cortado sherry,0,0,35,0,10,75,75,80,0,25,60,5,50,10
1938,Michel Couvreur Overaged Malt 12 Year,90,3,43.0,ex-sherry,20,0,65,30,30,55,55,70,0,0,40,30,70,40
1939,Bowmore Small Batch,331,2,40.0,ex-bourbon,50,40,15,25,15,65,65,65,30,20,25,0,20,0
1940,The Steward's Solera Bourbon,17,2,50.0,new charred oak,10,0,40,0,10,70,70,75,0,0,30,20,35,0
1941,Ranger Creek .36 Texas Bourbon,113,3,48.0,"new, charred American oak",55,0,80,45,30,55,50,65,0,0,60,40,50,0
1942,Arran Cask Strength 12 Year Batch 3,58,3,53.9,ex-bourbon and ex-sherry,25,0,86,64,83,86,86,82,60,62,81,40,84,69
1943,Elijah Craig 21 Year Single Barrel Bourbon,61,5,45.0,"new, charred American oak",0,0,79,45,63,85,83,73,0,0,81,69,71,54
1944,George Dickel Rye,666,2,45.0,"new, charred American oak",0,0,85,87,73,70,64,59,20,20,65,63,70,78
1945,Koval Single Barrel Four Grain,213,2,47.0,"new, charred American oak",60,0,75,80,55,55,65,70,0,0,65,35,35,10
1946,Writers' Tears Copper Pot,823,3,40.0,ex-bourbon,0,0,40,20,30,40,40,75,0,0,40,50,60,20
1947,Aberlour 12 Year Sherry Cask Matured,514,3,43.0,first fill oloroso sherry,15,0,20,0,10,70,70,70,0,0,10,0,35,5
1948,FEW Single Malt Whisky,112,3,46.5,,30,0,60,60,40,55,55,40,0,0,40,20,45,0
1949,Coppersea New York Raw Rye,4,2,45.0,,0,0,20,10,10,80,80,70,0,0,10,0,40,20
1950,Tullibardine 228 Burgundy Finish,195,3,43.0,ex-Burgundy wine casks,0,0,70,10,10,70,80,70,0,10,80,20,90,70
1951,Kavalan Solist Oloroso Sherry Single Cask Strength,308,5,57.8,ex-oloroso sherry,0,0,60,35,30,90,90,50,0,0,55,30,70,10
1952,Barterhouse 20 Year Bourbon,593,4,45.1,"new, charred American oak",55,0,70,30,20,60,70,75,0,0,75,20,30,0
1953,Berkshire Mountain New England Corn Whiskey,18,2,43.0,used oak & cherrywood,0,0,50,20,50,60,70,60,0,0,20,40,80,30
1954,Benromach 10 Year,608,2,43.0,,30,35,5,5,0,60,60,65,0,5,15,0,12,0
1955,Yellow Rose Outlaw Bourbon,163,3,46.0,"new, charred American oak",40,0,70,40,30,60,60,40,0,0,40,30,40,0
1956,Arran Port Cask Finish Single Malt,126,3,50.0,"ex-bourbon, ex-port",0,0,40,30,30,50,50,70,0,30,30,40,70,50
1957,Corsair Quinoa Whiskey,76,3,46.0,,0,0,15,15,0,80,70,70,0,0,8,10,20,10
1958,Michter's 25 Year Single Barrel Bourbon,22,5,54.3,new charred oak,0,0,20,0,0,60,60,75,0,0,20,0,10,0
1959,Amrut Peated Indian Single Malt,106,3,46.0,,40,30,80,40,20,50,50,70,0,0,50,20,60,20
1960,Jura Diurachs' Own 16 Year,328,3,40.0,"ex-bourbon, ex-Amoroso sherry",20,0,50,40,40,60,60,70,30,30,30,50,70,20
1961,Auchentoshan American Oak,1301,2,40.0,ex-bourbon,30,0,50,30,30,50,50,60,0,0,60,50,70,30
1962,BenRiach Arumaticus Fumosus 12 Year,21,3,46.0,"ex-Bourbon, ex-Jamaican rum ",60,70,50,40,40,50,50,60,0,10,30,40,50,20
1963,Old Forester Birthday Bourbon 2013,71,3,49.0,"new, charred American oak",50,0,20,30,50,50,60,50,0,0,70,20,50,40
1964,Michael Collins 10 Year Single Malt,50,2,40.0,ex-Bourbon,30,30,30,30,30,60,60,70,0,0,40,40,70,10
1965,Powers Signature Release,121,2,46.0,"ex-bourbon, ex-Oloroso sherry",20,0,50,20,30,60,60,70,0,0,30,40,60,30
1966,Glen Garioch Virgin Oak,23,4,48.0,new American Oak,30,0,70,60,40,50,50,50,20,0,60,50,50,20
1967,Knappogue Castle 16 Year Sherry Cask Finished,130,4,40.0,"ex-Bourbon, ex-Oloroso Sherry",30,0,60,40,40,70,70,70,0,0,60,30,70,30
1968,Tyrconnell Single Malt,435,2,40.0,used oak barrels,30,0,60,50,40,60,60,60,0,0,60,30,60,30
1969,Tomintoul 16 Year,267,3,40.0,ex-Bourbon,30,0,70,30,30,60,60,70,0,10,60,40,70,30
1970,Nikka Miyagikyo 12 Year,103,4,45.0,,10,0,40,20,20,60,60,60,10,10,50,20,60,40
1971,The Glenrothes Select Reserve,522,2,43.0,"ex-sherry and ex-bourbon, new and used",10,0,60,20,10,60,60,60,10,10,70,20,70,30
1972,The Glenrothes Alba Reserve,54,2,40.0,ex-Bourbon,20,0,60,20,20,60,60,70,10,10,70,30,70,10
1973,Arran 14 Year (Old Label),212,3,46.0,"ex-Bourbon, ex-Oloroso Sherry",10,0,60,20,20,70,60,70,50,50,60,20,90,90
1974,Jameson 12 Year Special Reserve,1022,3,40.0,"ex-Bourbon, ex-Oloroso Sherry",20,0,50,30,30,60,60,70,10,10,50,40,70,20
1975,Jura Origin 10 Year,697,2,40.0,ex-Bourbon,20,10,50,50,40,50,40,70,10,30,50,60,60,50
1976,Balvenie Doublewood 12 Year,5955,3,40.0,"traditional American oak barrels and hogsheads, Spanish oak ex-oloroso sherry",30,0,30,10,20,70,70,70,10,10,70,40,70,30
1977,Glenfarclas 12 Year,997,3,43.0,European oak oloroso sherry casks,40,10,40,30,40,60,60,70,10,20,40,40,70,50
1978,Georgia Moon Corn Whiskey,41,1,40.0,Un-Aged,0,0,5,20,0,10,10,80,0,0,10,5,40,5
1979,Scapa 16 Year,344,4,40.0,ex-Bourbon,20,0,50,40,40,50,50,70,40,60,50,50,50,50
1980,Kilchoman 100% Islay (2nd Edition),75,4,50.0,Ex-Bourbon,20,60,60,30,40,30,40,30,30,50,40,10,40,10
1981,Kilchoman Loch Gorm (2015 Edition),117,4,46.0,Ex-Oloroso Sherry,70,80,50,0,60,90,80,70,90,70,30,0,10,0
1982,Nikka Yoichi 10 Year,161,4,45.0,Oak Casks,30,10,30,0,40,50,60,40,0,0,40,10,45,10
1983,Glenmorangie Lasanta Sherry Cask Finish 12 Year,2571,3,43.0,"ex-bourbon, finished in ex-oloroso & Pedro Ximenez sherry butts",30,10,70,20,40,50,70,80,10,20,70,50,80,50
1984,Cardhu 12 Year,1285,2,40.0,,10,10,30,40,30,60,60,70,10,10,60,50,60,50
1985,Bruichladdich Rocks,103,2,46.0,"ex-bourbon, finished in red Grenache wine casks",30,30,40,10,30,50,50,70,20,30,60,60,90,60
1986,Sazerac Rye,3124,2,45.0,"new, charred American oak   ",30,0,50,35,10,40,40,60,0,0,35,55,65,0
1987,Laphroaig Quarter Cask,3097,3,48.0,Ex-Bourbon & Modified Ex-Bourbon Quarter Cask,40,70,60,50,70,60,60,50,20,30,40,30,60,10
1988,Longrow Red 11 Year Cabernet Sauvignon Finish,43,4,52.1,ex-bourbon & ex-cabernet sauvignon,87,88,60,70,79,88,86,74,83,82,73,62,86,63
1989,Caol Ila 12 Years,2840,3,43.0,ex-bourbon casks,54,56,72,78,81,83,81,73,20,20,65,76,71,67
1990,Ardmore Traditional Cask,207,2,46.0,"American oak, finished in Quarter Casks",40,50,60,40,40,50,50,50,0,0,40,40,40,20
1991,Connemara 12 Year Peated Single Malt,399,3,40.0,ex-bourbon,60,60,60,40,60,60,60,60,40,40,60,30,30,10
1992,FEW Straight Bourbon,672,2,46.5,"new, charred American oak",20,0,70,40,40,40,50,70,0,0,50,50,70,30
1993,Cyrus Noble Bourbon,59,2,45.0,New American White Oak Barrels,15,0,50,65,20,50,50,65,0,0,35,35,55,35
1994,Maker's Mark Bourbon,8675,2,45.0,"new, charred American oak",10,0,40,30,10,50,70,80,0,0,90,20,10,0
1995,Early Times 354 Bourbon,47,1,40.0,"new, charred American oak",10,0,15,0,0,60,60,70,0,0,20,10,35,0
1996,Puncher's Chance The Left Cross Bourbon,2,4,48.0,"new, charred American oak; finished in Jamaican dark rum casks",5,0,30,5,5,65,60,30,0,0,20,5,25,0
1997,Woodinville Straight 100% Rye Ruby Port Cask Finish (2022 Harvest Release),4,3,45.0,finished in ruby port casks,0,0,70,60,20,60,50,30,0,0,50,60,90,10
1998,New Riff Maltster T50 Crystal Malt,3,3,50.0,"new, charred American oak",25,0,45,55,10,35,35,30,0,0,35,10,10,0
1999,Old Overholt 4 Year Straight Rye Whiskey (86 Proof),5,1,43.0,"new, charred American oak",30,0,80,70,40,60,40,20,0,0,60,50,40,10
2000,Buzzard's Roost Toasted American Oak Straight Bourbon,1,3,52.5,finished in toasted American oak barrels,5,0,65,20,5,50,50,25,0,0,10,20,10,0
2001,Nelson Brothers Reserve Bourbon,30,3,53.9,"new, charred American oak",35,0,65,20,40,60,60,50,0,0,35,35,45,0
2002,Jack Daniel's Triple Mash,131,2,50.0,"new, charred American oak",30,0,80,30,15,40,40,45,0,0,40,40,40,0
2003,Wild Turkey Master's Keep Unforgotten,18,5,52.5,"new, charred American oak; finished in rye whiskey barrels",35,0,70,20,30,65,65,55,0,0,35,30,30,0
2004,Basil Hayden Subtle Smoke,78,2,40.0,"finished in toasted, lightly charred barrel infused with hickory smoke",70,0,50,30,20,60,80,40,0,0,80,20,20,0
2005,The Wiseman Kentucky Straight Rye,16,3,50.4,"new, charred American oak",10,0,80,80,10,60,50,30,0,0,60,40,20,0
2006,Puncher's Chance The D12tance Bourbon,4,4,48.0,"new, charred American oak; finished in French oak California cabernet sauvignon wine barrels",10,0,30,10,50,70,80,60,0,0,40,40,80,30
2007,Lost Irish Whiskey,9,2,40.0,,5,0,40,5,10,85,70,50,5,0,20,10,50,3
2008,Glenmorangie A Tale of Winter,40,4,46.0,finished in Marsala wine casks,0,0,50,40,20,60,70,40,0,20,80,40,70,20
2009,Compass Box No Name No. 3,21,4,48.9,,60,50,20,25,10,45,45,40,30,10,5,20,15,0
2010,Talisker 8 Year (2021 Special Release),14,4,59.7,heavily-peated refill casks,60,30,25,20,10,45,45,40,10,10,15,5,30,5
2011,High West A Midwinter Night's Dram Act 9 (All Scenes),121,4,49.3,"new, charred American oak, ex-tawny Port, ex-ruby Port ",10,0,70,60,50,70,70,40,0,10,50,80,80,20
2012,Highland Park Cask Strength Release No. 2,31,4,63.9,sherry seasoned European and American oak casks; ex-bourbon,50,40,20,40,15,45,45,30,25,15,10,15,50,0
2013,Barrell Bourbon Batch 030,19,4,58.66,"new, charred American oak",20,0,70,70,50,90,30,20,0,10,60,40,30,0
2014,Douglas Laing's Double Barrel Speyside & Lowland,0,3,46.0,,0,0,30,25,20,30,30,40,0,0,35,10,25,30
2015,Barrell Bourbon Batch 029,35,4,57.94,"new, charred American oak",10,0,30,5,10,80,80,60,0,15,10,35,30,0
2016,Rod & Hammer's SLO Stills Cask Bourbon,5,2,56.0,"new, charred American oak",20,0,60,70,20,70,50,40,0,0,80,40,20,0
2017,High West Rendezvous Rye Ed Mell Edition (2021 Release),37,3,46.0,,10,0,60,70,50,60,50,40,0,0,70,60,50,10
2018,Virginia Distillery Co. Courage & Conviction Sherry Cask,27,4,46.0,"former fino, oloroso, and Pedro Ximenez sherry casks",10,0,50,25,65,60,60,55,10,5,55,20,35,20
2019,Paul Sutton Single Barrel Bourbon,14,3,50.0,,30,0,60,30,40,80,40,40,0,20,80,20,30,0
2020,Virginia Distillery Co. Courage & Conviction Cuvée Cask,53,4,46.0,European red wine STR casks,10,0,50,20,55,60,65,60,10,5,55,20,35,20
2021,Waterford Dunmore Edition 1.1,7,4,50.0,"ex-bourbon, French oak, new American oak, and ex-VDN, ",0,0,30,20,20,60,40,40,0,0,60,70,80,40
2022,Coalition Rye Margaux Barriques Finish,5,4,45.4,finished in Margaux barriques,25,0,75,35,15,55,55,35,0,0,30,50,50,0
2023,Kooper Family Single Barrel Bourbon,6,2,46.0,"new, charred American oak (char #3)",30,0,50,50,40,50,70,50,0,30,70,40,40,10
2024,PUNI Gold,2,4,43.0,first-fill ex-bourbon barrels,5,0,30,0,20,75,75,65,0,0,30,25,70,10
2025,Stauning Rye,26,3,48.0,,20,0,60,80,30,70,50,50,0,0,70,50,40,40
2026,Tattersall Bottled in Bond High-Rye Bourbon,7,2,50.0,"new, charred American oak",30,0,80,60,40,70,40,30,0,0,70,40,10,0
2027,Cedar Ridge Straight Rye Whiskey,5,2,43.0,"new, charred American oak",5,0,40,30,45,60,50,65,10,5,65,35,35,30
2028,Shibui Pure Malt,8,3,43.0,"ex-bourbon, oloroso sherry, mizunara oak casks",10,0,40,25,45,60,55,55,10,10,55,10,25,25
2029,Virginia Distillery Co. Courage & Conviction Dr. Jim Swan Batch,6,3,46.0,"bourbon, wine, sherry ",0,0,15,20,0,65,65,80,0,0,30,20,70,30
2030,Jura Winter Edition,15,2,40.0,ex-bourbon and ex-sherry casks,0,0,40,20,35,35,30,30,0,0,20,35,40,10
2031,The Busker Triple Cask Triple Smooth,55,1,40.0,"ex-bourbon, ex-sherry, ex-Marsala wine",5,0,40,25,45,50,40,60,5,0,50,30,40,35
2032,Wheel Horse Bourbon (Batch 1),22,2,50.5,"new, charred American oak",10,0,65,20,50,55,60,65,10,5,60,30,25,20
2033,Lost Lantern American Vatted Malt Edition No. 1,8,4,52.5,various casks,15,0,25,15,40,60,60,55,0,0,10,36,70,0
2034,Elijah Craig Barrel Proof Bourbon Batch C920,147,3,66.4,"new, charred American oak",10,0,30,5,0,85,85,75,0,0,30,40,50,5
2035,Old Overholt Straight Rye Whiskey (114 Proof),31,2,57.0,"new, charred American oak",40,0,75,35,15,30,30,35,0,0,40,40,50,0
2036,Pinhook Bohemian Bourbon,61,2,47.5,"new, charred American oak",5,0,40,25,55,55,60,65,10,5,55,15,30,25
2037,Pinhook 4 Year Tiz Rye Time Vertical Series,17,2,48.5,"new, charred American oak",5,0,55,20,50,55,60,60,5,0,60,20,25,15
2038,Smokehead Rum Rebel,42,3,46.0,finished in Caribbean rum casks,35,30,15,10,20,35,30,40,15,15,30,15,20,0
2039,Westland Colere Edition 1,11,4,50.0,2nd fill ISC Cooper's Reserve & 1st-fill ex-bourbon,40,0,30,50,10,70,80,50,0,20,70,40,30,50
2040,Little Book Chapter 4: Lessons Honored,166,4,61.4,"new, charred American oak",5,0,35,15,0,90,80,70,0,0,20,15,10,0
2041,Two Stacks The Blender's Cut Cask Strength,32,3,65.15,"virgin oak casks, ex-bourbon casks, ex-oloroso sherry butts",10,0,50,60,30,80,60,30,0,10,70,30,50,10
2042,Chattanooga Whiskey 99 Rye,59,2,49.5,"new, charred American oak",10,0,45,25,55,50,55,60,5,5,60,35,35,20
2043,Still Austin The Musician Straight Bourbon,131,2,49.2,"new, charred American oak",10,0,40,20,50,55,55,60,10,5,60,30,20,25
2044,Glenlivet 12 Year Illicit Still,93,2,48.0,,0,0,35,30,20,30,30,40,0,0,40,20,25,25
2045,Penderyn Icons of Wales #7 Rhiannon,13,3,46.0,Sherrywood Grand Cru Finish,0,0,20,10,30,35,25,55,0,0,40,20,45,10
2046,Cardhu 11 Year (2020 Special Release),7,4,56.0,"refill, new, and ex-bourbon American oak",0,0,35,30,30,35,20,25,0,0,35,25,20,10
2047,Kooper Family Rye,10,2,45.0,"new, charred American oak, finished in used bourbon",30,0,70,80,45,60,75,30,0,20,50,30,0,40
2048,Balcones Lineage Texas Single Malt,183,2,47.0,"refill oak barrels and new, charred American oak",15,0,60,15,65,65,60,65,10,5,60,10,15,10
2049,Frey Ranch Straight Rye,51,3,50.0,"new, charred American oak",10,0,65,30,55,60,65,60,15,5,65,20,30,15
2050,Bardstown Bourbon Co. Fusion Series #3,116,3,49.45,"new, charred American oak",10,0,30,40,20,60,50,40,0,10,70,50,40,0
