,name,total_rating,cost_rank,abv,cask_type,smoky,peaty,spicy,herbal,oily,full_bodied,rich,sweet,briny,salty,vanilla,tart,fruity,floral
2051,Virginia Distillery Co. Courage & Conviction Dr. George G. Moore Batch,48,3,46.0,"ex-bourbon, ex-sherry, ex-cuvée",10,0,40,20,40,60,70,60,0,10,80,20,60,30
2052,Knob Creek 9 Year Small Batch Bourbon,931,2,50.0,"new, charred American oak",15,0,65,20,55,60,65,60,10,5,65,10,20,15
2053,Ardbeg Wee Beastie,812,2,47.4,ex-bourbon and ex-oloroso sherry,60,40,20,0,40,60,60,50,90,70,60,10,40,10
2054,Bowmore Vault Edition Second Release Peat Smoke,22,5,50.1,,40,10,0,15,0,0,0,10,5,0,0,0,20,0
2055,The Whistler Double Oaked,46,2,40.0,ex-bourbon and ex-oloroso sherry,5,0,40,30,50,55,60,60,10,5,60,15,35,30
2056,Frey Ranch Straight Bourbon,121,2,45.0,"new, charred American oak",5,0,45,20,50,50,55,55,5,5,60,20,25,20
2057,M&H Whisky in Bloom Young Single Malt Double Cask,6,3,46.0,ex-bourbon and ex-red wine STR casks,5,0,40,30,45,55,55,50,30,15,40,30,30,25
2058,M&H Whisky in Bloom Young Single Malt Lightly Peated,12,3,46.0,"ex-borbon, ex-red wine STR casks, ex-Islay peated whisky casks",15,25,55,35,55,55,60,45,35,15,45,25,20,10
2059,McConnell's Irish Whisky 5 Year,55,2,42.0,American oak,10,0,30,40,40,50,60,50,0,0,80,40,70,60
2060,Teeling Single Pot Still,77,3,46.0,"ex-bourbon, virgin oak, ex-sherry",5,0,40,30,50,55,55,50,20,10,45,25,20,20
2061,The Whistler Imperial Stout Cask Finish,14,2,43.0,"ex-bourbon barrels, Boyne Brewhouse Imperial Stout hogshead barrels",10,0,55,20,60,60,65,55,10,5,55,25,15,25
2062,Egan's Centenary Irish Whiskey,8,4,46.0,married in French Limousin oak ex-cognac XO barrels,5,0,20,35,30,40,40,45,10,5,40,35,30,25
2063,Wanderback American Single Malt Batch No. 1,6,3,45.0,"high toast, low char new American oak",15,0,55,30,55,55,60,50,20,10,50,35,20,25
2064,Chivas Regal 13 Year Manchester United Special Edition,31,2,40.0,selectively finished in American rye casks,0,0,70,40,75,80,60,70,20,65,70,40,55,30
2065,Dewar's Caribbean Smooth,114,1,40.0,finished in ex-Caribbean rum casks,5,0,20,25,45,55,55,65,10,5,60,20,15,15
2066,Remus Repeal Reserve Series III (2019 Medley),89,4,50.0,"new, charred American oak",0,0,60,40,50,60,70,85,0,55,80,40,30,40
2067,Chattanooga Whiskey 91,195,2,45.5,Toasted and charred oak; finished in charred oak solera,5,0,30,20,45,50,50,55,10,10,50,30,25,15
2068,GlenAllachie 12 Year Pedro Ximenez Sherry Wood Finish,25,3,48.0,American oak & ex-Pedro Ximenez sherry puncheons,0,0,20,15,35,40,35,35,0,0,20,20,40,25
2069,Finlaggan Red Wine Cask Matured,13,2,46.0,finished in red wine casks,35,45,35,10,25,40,25,50,10,15,30,10,25,5
2070,"Colonel E.H. Taylor, Jr. Amaranth Bourbon Bottled in Bond",76,3,50.0,"new, charred American oak",30,0,80,60,10,80,40,40,0,0,50,20,0,0
2071,Mackmyra Äppelblom,21,3,46.1,ex-calvados,0,0,25,10,30,30,30,25,5,0,35,35,45,25
2072,Scarabus Single Malt,95,2,46.0,,35,35,5,0,5,0,0,10,10,0,0,0,0,0
2073,Armorik Triagoz Single Malt,4,4,46.0,Ex-bourbon casks,30,10,35,40,35,25,35,20,10,15,25,10,20,5
2074,Rebel Yell Kentucky Straight Bourbon 100 Proof,283,1,50.0,"new, charred American oak",75,0,85,60,80,65,65,75,0,40,80,0,50,60
2075,Bare Knuckle Wheat Whiskey Single Barrel Cask Strength,8,2,60.95,"new, charred American oak",10,0,60,40,0,70,50,40,0,0,80,40,20,0
2076,TahWahKaro Four Grain Bourbon,24,3,48.0,,10,0,40,25,30,40,45,60,10,5,45,40,20,30
2077,Westland Black Raven Cask Exchange 2,10,4,50.0,ex-Westland whiskey (kriek style) & ex-bourbon (stout),10,0,40,35,60,50,60,55,15,10,40,35,40,20
2078,Tamdhu 12 Year,143,2,43.0,American oak and European oak oloroso sherry casks,0,0,20,10,25,25,35,25,0,0,35,20,30,10
2079,291 Colorado Bourbon Single Barrel,45,4,50.0,finished with charred Aspen staves,20,0,60,40,0,60,80,60,0,0,70,10,40,0
2080,Tullibardine The Murray Marsala Finish,9,3,46.0,first-fill bourbon & Sicilian marsala finish,0,0,15,10,40,35,40,45,0,0,20,20,35,10
2081,Signal Hill Canadian Whisky,48,2,40.0,"Ex-bourbon, New White Oak and Canadian Whisky",35,0,45,0,10,35,40,60,0,0,45,35,45,15
2082,Chocorua Straight Rye Whiskey,10,3,45.0,"new, charred American oak",15,0,65,35,60,55,55,45,15,10,50,25,15,25
2083,Caol Ila 13 Year Discovery (Gordon & Macphail),31,3,43.0,ex-bourbon,40,40,50,20,60,70,50,60,30,30,30,50,80,10
2084,Port Askaig 14 Year,3,4,45.8,First-fill bourbon casks,35,50,10,15,25,40,30,10,25,30,20,20,10,5
2085,High West A Midwinter Night's Dram Act 6 (All Scenes),204,4,49.3,finished in French oak port wine barrels,30,0,90,60,30,80,50,50,0,0,70,20,40,0
2086,Fukano Vault Reserve 1,46,4,40.5,,10,0,20,35,45,55,55,50,10,5,40,15,15,20
2087,Spica 20 Year (North Star Spirits),1,3,45.2,ex-sherry casks,0,0,20,20,40,50,35,50,0,0,25,25,40,10
2088,MacNair's Lum Reek Peated Small Batch,17,3,46.0,"ex-bourbon, ex-oloroso sherry, virgin oak, ex-red wine",35,30,20,40,25,25,30,40,10,5,30,30,20,5
2089,Inverleven 1985 Private Collection (Gordon & MacPhail),2,5,57.4,refill bourbon barrel,0,0,35,20,50,35,40,25,0,0,40,20,35,10
2090,Kilchoman 100% Islay (8th Edition),28,4,50.0,ex-bourbon barrels & ex-oloroso sherry butts,45,60,50,35,20,45,50,10,40,25,30,0,0,20
2091,The Glenrothes 10 Year,120,2,40.0,sherry seasoned oak,0,0,75,40,50,40,70,80,20,20,30,20,60,30
2092,Octomore 09.1 Dialogos,99,5,59.1,ex-American whiskey casks,40,40,45,35,30,55,30,35,10,15,40,15,15,20
2093,Blackened Whiskey,520,2,45.0,"finished in ""black brandy barrels""",0,0,30,10,25,40,40,45,0,0,35,30,35,20
2094,St. Augustine Single Barrel Select Straight Bourbon,13,2,47.0,"new, charred American oak",10,0,80,60,30,60,70,50,0,0,80,30,60,0
2095,Highland Park Valknut,122,3,46.8,American oak ex-sherry,80,60,50,50,70,70,60,60,0,20,50,0,50,20
2096,Talisker Select Reserve (Game of Thrones-House Greyjoy),223,2,45.8,,25,20,25,0,15,40,40,15,20,25,10,10,20,0
2097,Sierra Norte Native Oaxacan Black Corn,10,3,45.0,French oak,20,0,40,20,40,45,50,25,15,10,20,15,5,5
2098,Bowmore Vintner's Trilogy 27 Year Port Cask,7,5,48.3,ex-bourbon & port pipes,35,30,20,15,15,35,35,25,10,0,10,25,20,0
2099,Crown Royal Noble Collection 13 Year Blenders' Mash,49,3,45.0,"new, charred American oak",5,0,45,5,40,25,35,80,0,0,85,0,20,15
